{
  "$schema": "https://json-schema.org/draft/2020-12/schema",
  "title": "StoryLockPackageManifest",
  "type": "object",
  "required": ["packageId", "version", "createdAt", "files"],
  "properties": {
    "packageId": { "type": "string", "minLength": 1 },
    "version": { "type": "string", "minLength": 1 },
    "createdAt": { "type": "string", "minLength": 1 },
    "description": { "type": "string" },
    "files": {
      "type": "array",
      "minItems": 1,
      "items": { "type": "string", "minLength": 1 }
    }
  },
  "additionalProperties": false
}
